### ISSUE TITLE
Unable to get SNMP plugin work with version 3 authentication

### ISSUE THREAD

**Issue by ashuw018** [influxdata/telegraf#3655]
## Directions

I am trying to get telegraf working with SNMP plugin, everything works fine if the device ip in agent section is local network IP, but it does not work if i try same with any external networks device IP.

**Everything is working with snmpwalk, snmptable with local and external network device, but through telegraf it doesn't work for external device.

### Relevant telegraf.conf:
[[inputs.snmp]]
  agents = [ "x.x.x.x:161" ]
  version = 3
  
  sec_name = "myuser"
  auth_protocol = "SHA"      
  auth_password = "my_Auth"
  sec_level = "authPriv"  
  context_name = ""
  priv_protocol = "AES"        
  priv_password = "my_PWD"

  name = "system"
 [[inputs.snmp.field]]
    name = "hostname"
    oid = "RFC1213-MIB::sysName.0"
    is_tag = true

  [[inputs.snmp.table]]
    name = "snmp"
    inherit_tags = [ "hostname" ]
    oid = "IF-MIB::ifXTable"

    [[inputs.snmp.table.field]]
      name = "ifName"
      oid = "IF-MIB::ifName"
      is_tag = true

### System info:
Telegraf version = v1.5.0
Net snmp
Windows 10 and windows 2008 R2

### Steps to reproduce:

1. ...
2. ...

### Expected behavior:
It should work as it is working with local network devices
### Actual behavior:
It is working with local device but not with external device, also it should give some exact logs that exactly whats going wrong.

### Additional info:

Errors which i am getting

2018-01-09T09:19:24Z E! Error in plugin [inputs.snmp]: agent x.x.x.x:161: performing get on field hostname: Request timeout (after 3 retries)
2018-01-09T09:19:34Z E! Error in plugin [inputs.snmp]: agent x.x.x.x:161: gathering table snmp: performing bulk walk for field ifName: Request timeout (after 3 retries)

**Comment by danielnelson** [comment]
What do you mean by external device, are you referring to another host on the same subnet or to a device on a routed network?  There is a known issue where the response must be received from the same target host, I wonder if you are running into this: https://github.com/influxdata/telegraf/issues/3320

The logs seem to show what is going wrong, no response was received and request timeout, so I don't think they can be improved.

**Comment by ashuw018** [comment]
Hi Danielnelson,

By external device, i mean the device is not is our premises, it resides outside of our network. net-snmp and other tools like snmp-exporter + prometheus works fine with it. But through telegraf it doesn't work.

Might be i am running into #3320, not sure, but yes it works through telegraf as well if i try to perform same things on any local/on premise device.

Thanks,

**Comment by danielnelson** [comment]
That is interesting that snmp-exporter is working, since we are both using the same gosnmp library. @phemmer do you have any idea what could cause this?

**Comment by phemmer** [comment]
Without seeing packet captures, not really. The only immediate thought is the default 5s timeout.

**Comment by danielnelson** [comment]
@ashuw018 Do you think you could collect a packet dump?  There is an example of how to do it on unix systems here https://github.com/soniah/gosnmp#packet-captures.  It would be helpful to collect it once with `snmpget`, and once using `telegraf --input-filter snmp --test`.

@phemmer Do you think it would be useful if I wrote a clone of snmpget/snmpwalk using the gosnmp library?  We could add debugging code as needed and then users could run this when they have a problem.

**Comment by ashuw018** [comment]
Hi Daniel and Phemmer,

Thanks for taking efforts. Here is another update from my end. 
I am now more surprised as now i have installed telegraf and netsnmp on one of the external server which is internal to the external snmp device regarding which this issue has been created. Unfortunately it is not working from there as well. And the issue seems to be SNMPv3 specific as from there it ia working fine with SNMPv2. Don't know what i am doing wrong with SNMPv3 as i get data over SNMPv3 by using netsnmp snmpwalk snmpget snmptable, with snmp exporter as well but not with telegraf.

This might change our investigation direction with this issue.. to me as of now snmpv2 is working and snmpv3 is not.

Thanks,

**Comment by danielnelson** [comment]
This might be https://github.com/soniah/gosnmp/issues/95

**Comment by rrasale** [comment]
Can you run a snmpwalk to your destination device from your telegraf server ? Do you see any output ?

**Comment by ashuw018** [comment]
@rrasale Yes i do see valid output from snmpwalk over version 3. in fact using snmp exporter and prometheus it works perfect over snmpv3.

**Comment by glazzari** [comment]
Hi, I'm getting the same error. I can snmpwalk to the production server from my machine, but telegraf is returning request timeout. For example:

```
$ snmpwalk -mALL -On -v2c -cintcacti <target> 1.3.6.1.4.1.35750.10.2.1.1.1

.1.3.6.1.4.1.35750.10.2.1.1.1.0 = Counter64: 768886
```

```
$ sudo tcpdump -s 0 -i eno1 host [target] and port 161

17:35:43.398564 IP [src].51646 > [target].snmp:  C="intcacti" GetNextRequest(33)  E:35750.10.2.1.1.1
17:35:43.425641 IP [target].snmp > [src].51646:  C="intcacti" GetResponse(37)  E:35750.10.2.1.1.1.0=769168
17:35:43.425777 IP [src].51646 > [target].snmp:  C="intcacti" GetNextRequest(34)  E:35750.10.2.1.1.1.0
17:35:43.451014 IP [target].snmp > [src].51646:  C="intcacti" GetResponse(38)  E:35750.10.2.1.1.2.0=240797616
```

I'm running the official [docker image](https://hub.docker.com/_/telegraf/) of telegraf, which exposes the following ports:

```
8125/udp 8092/udp 8094
```

SNMP plugin is configured as:

```
[[inputs.snmp]]
  agents = [ "<target>" ]
  version = 2
  community = "cintcacti"
  name = "system"

  [[inputs.snmp.field]]
    name = "total"
    oid = "1.3.6.1.4.1.35750.10.2.1.1.1"
```

```
telegraf    | 2018-01-17T19:46:20Z E! Error in plugin [inputs.snmp]: took longer to collect than collection interval (10s)
telegraf    | 2018-01-17T19:46:20Z E! Error in plugin [inputs.snmp]: agent [target]: performing get on field total: Request timeout (after 3 retries)
```

```
$ telegraf --input-filter snmp --test

2018/01/17 19:46:34 I! Using config file: /etc/telegraf/telegraf.conf
* Plugin: inputs.snmp, Collection 1
2018-01-17T19:46:44Z E! Error in plugin [inputs.snmp]: agent [target]: performing get on field total: Request timeout (after 3 retries)
```

```
$ sudo tcpdump -s 0 -i eno1 host [target] and port 161

17:41:00.012307 IP [src].34905 > [target].snmp:  C="cintcacti" GetRequest(33)  E:35750.10.2.1.1.1
17:41:01.262567 IP [src].34905 > [target].snmp:  C="cintcacti" GetRequest(33)  E:35750.10.2.1.1.1
17:41:02.512643 IP [src].34905 > [target].snmp:  C="cintcacti" GetRequest(33)  E:35750.10.2.1.1.1
17:41:03.762995 IP [src].34905 > [target].snmp:  C="cintcacti" GetRequest(33)  E:35750.10.2.1.1.1
```

**Comment by danielnelson** [comment]
@glazzari Can you test with this field:
```
[[inputs.snmp.field]]
  name = "hostname"
  oid = ".1.3.6.1.2.1.1.5.0"
```

and save the capture with:
```
sudo tcpdump -s 0 -i eno1 -w test.pcap host [target] and port 161
```

Capturing both commands would be helpful:
```
snmpget -v2c -c public 10.79.40.63:161 .1.3.6.1.2.1.1.5.0
telegraf --input-filter snmp --test
```

**Comment by glazzari** [comment]
@danielnelson same results. I can snmpwalk correctly, but the plugins fails with request timeout.

```
$ snmpwalk -On -v2c -cintcacti [target] .1.3.6.1.2.1.1.5.0

.1.3.6.1.2.1.1.5.0 = STRING: [returns sysName]
```

```
$ sudo tcpdump -s 0 -i eno1 host [target] and port 161             

09:44:05.601227 IP [src].59290 > [target].snmp:  C="intcacti" GetNextRequest(28)  system.sysName.0
09:44:05.629768 IP [target].snmp > [src].59290:  C="intcacti" GetResponse(52)  system.sysLocation.0="[returns sysLocation]"
09:44:05.629909 IP [src].59290 > [target].snmp:  C="intcacti" GetRequest(28)  system.sysName.0
09:44:05.659471 IP [target].snmp > [src].59290:  C="intcacti" GetResponse(35)  system.sysName.0="[returns sysName]"
```

```
$ telegraf --input-filter snmp --test
2018/01/18 11:51:47 I! Using config file: /etc/telegraf/telegraf.conf
* Plugin: inputs.snmp, Collection 1
2018-01-18T11:51:57Z E! Error in plugin [inputs.snmp]: agent [target]: performing get on field hostname: Request timeout (after 3 retries)
```

**Comment by glazzari** [comment]
Not sure if it's related to #3320.

**Comment by danielnelson** [comment]
If the response source matches the request target then I don't think it is #3320

I notice that tcpdump reports the community name differently:
```diff
- C="intcacti"
+ C="cintcacti"
```

**Comment by glazzari** [comment]
Good catch! I've just noticed the community name in telegraf.conf was including the 'c' as part of its name. This is probably a copy/paste error, because I was running snmpwalk with "-cintcacti" instead of "-c intcacti". Note the space after the "-c".

```
[[inputs.snmp]]
  agents = [ "172.16.15.147:161" ]
  version = 2
  community = "intcacti"
```

**Comment by danielnelson** [comment]
Did fixing that help?

**Comment by glazzari** [comment]
Yes! Thank you very much for your help.

**Comment by danielnelson** [comment]
@ashuw018 Could you upload your working snmp_exporter configuration for comparison against the Telegraf plugin?

**Comment by ashuw018** [comment]
@danielnelson Requested is attached.

[prometheus.txt](https://github.com/influxdata/telegraf/files/1651090/prometheus.txt)
[snmpexporter.txt](https://github.com/influxdata/telegraf/files/1651091/snmpexporter.txt)

**Comment by danielnelson** [comment]
@ashuw018 Is this the agent you are unable to connect to?  I notice the priv_protocl is DES while above in Telegraf it was set to AES.
```
if_mib:

  version: 3
  auth:
    username: user
    password: password
    #
    auth_protocol: SHA
    security_level: authPriv
    priv_protocol: DES
    priv_password: Passwordpriv
```

**Comment by ashuw018** [comment]
Hi Daniel

Thats just a typo while filling dummy data for posting. 

I am using AES in both. And tried with DES also.

**Comment by danielnelson** [comment]
We also have the report about complex passwords causing problems, would it be possible to test, temporarily of course, if it helps to use a weak password with only ascii letters?

**Comment by ashuw018** [comment]
Hi Daniel,

Sorry for the delayed response. Actually we are going to testing phase with influxdb so the password were already kept simple. No character variations have been used.

**Comment by danielnelson** [comment]
@phemmer Do you know if it is possible to collect packet captures of version 3?  I assume we would need `sec_level = NoAuthNoPriv`?

**Comment by phemmer** [comment]
oh, hrm. It's been so long since I've worked with anything using v3 I'm not sure what the protocol looks like. But to be safe yes, `NoAuthNoPriv` should ensure that you can view all request/response fields.

**Comment by danielnelson** [comment]
@ashuw018 Would it be possible to use `NoAuthNoPriv` temporarily?  If you could capture the packets like this for both Telegraf and snmpget:
```
sudo tcpdump -s 0 -i [interface] -w test.pcap host [target] and port 161
```

BTW I looked through the snmp_exporter code for usage differences, but didn't see anything that stood out.

**Comment by ashuw018** [comment]
@danielnelson I will reach to our NetSec support this Monday and will check if they can make such changes to get the required. If they allow me. I will definitely do that.

Also is there any net snmp compatible command for above?. As i do not have any linux box out there. All are windows.

Thanks.

**Comment by danielnelson** [comment]
It should be possible to use this windows version: https://www.winpcap.org/windump/, though I have not tested it.   You run the tcpdump command in one shell while in another you run the net-snmp command, then you stop the tcpdump command and it should print that it captured some packets.

**Comment by ashuw018** [comment]
@danielnelson  I approached to our support staff with this request but they denied to make config with NoAuthNoPriv as it is against there data center norms they said to me. Unfortunately in my local office i do not have any device which can snmp v3 so that i can get this tested here.

**Comment by danielnelson** [comment]
Understandable, I will try to setup a v3 device for testing but it might take me awhile.

**Comment by cpajr** [comment]
Any update on this issue?  I'm encountering the same problem.

**Comment by danielnelson** [comment]
@cpajr I did do a sanity test using snmp v3 to a net-snmp server and didn't have any trouble.  Are you also using Windows and what kind of device are you querying?

**Comment by danielnelson** [comment]
@cpajr Can you create a packet capture doing a snmpget and an equivalent query with Telegraf (with a single top level field).  I think even with v3 security enabled it may be of some use, here is an example tcpdump:
```
sudo tcpdump -s 0 -i eth0 -w telegraf.pcap host 203.50.251.17 and port 161
```

Then upload these files along with your Telegraf snmp configuration (don't forget to remove your passwords or use a testing password).

**Comment by ashuw018** [comment]
Hi Just FYI.
Mine device was also cisco ASA 5515.

**Comment by cpajr** [comment]
@danielnelson I'll work to get this.  It also appears that we have a commonality on the trouble device: Cisco ASA.

**Comment by danielnelson** [comment]
I just found this https://github.com/soniah/gosnmp/pull/108, I'll update our gosnmp dependency if you both can test it out.

**Comment by cpajr** [comment]
Let me know what needs to be updated and I will test it.

**Comment by cpajr** [comment]
That did the trick.  Thank you.

**Comment by danielnelson** [comment]
I'll include this change in 1.6.0-rc3
