### ISSUE TITLE
SNMPv3 with MD5 auth and DES priv fails to authenticate since 1.18.2

### ISSUE THREAD

**Issue by schwartzpub** [influxdata/telegraf#12435]
### Relevant telegraf.conf

```toml
[global_tags]

[agent]
  interval = "10s"
  round_interval = true
  metric_batch_size = 1000
  metric_buffer_limit = 10000
  collection_jitter = "0s"
  flush_interval = "10s"
  flush_jitter = "0s"
  precision = "0s"
  hostname = ""
  omit_hostname = false

[[inputs.snmp]]
  agents = ["udp://192.168.1.21:161"]
  version = 3
  sec_name = "$SNMPv3_USER"
  auth_protocol = "MD5"
  auth_password = "$SNMPv3_PASS"
  sec_level = "authPriv"
  priv_protocol = "DES"
  priv_password = "$SNMPv3_PASS"

  name = "Dell N-Series"
  [[inputs.snmp.table]]
    name = "Dell N-Series Interface"
    [[inputs.snmp.table.field]]
      name = "ifName"
      oid = "IF-MIB::ifName"
      is_tag = true
    [[inputs.snmp.table.field]]
      name = "ifDescr"
      oid = "IF-MIB::ifDescr"
      is_tag = true
    [[inputs.snmp.table.field]]
      name = "ifIndex"
      oid = "IF-MIB::ifIndex"
      is_tag = true
    [[inputs.snmp.table.field]]
      name = "ifInOctets"
      oid = "IF-MIB::ifInOctets"
    [[inputs.snmp.table.field]]
      name = "ifOutOctets"
      oid = "IF-MIB::ifOutOctets"
    [[inputs.snmp.table.field]]
      name = "agentPortStatsRateBitsPerSecondRx"
      oid = "DNOS-SWITCHING-MIB::agentPortStatsRateBitsPerSecondRx"
    [[inputs.snmp.table.field]]
      name = "agentPortStatsRateBitsPerSecondTx"
      oid = "DNOS-SWITCHING-MIB::agentPortStatsRateBitsPerSecondTx"
```

### Logs from Telegraf

```text
2022-12-23T12:07:04Z I! Starting Telegraf 1.18.2
2022-12-23T12:07:04Z D! [agent] Initializing plugins
2022-12-23T12:07:04Z D! [agent] Starting service inputs
2022-12-23T12:07:04Z D! [inputs.snmp] executing "snmptranslate" "-Td" "-Ob" "IF-MIB::ifName"
2022-12-23T12:07:04Z D! [inputs.snmp] executing "snmptranslate" "-Td" "-Ob" "IF-MIB::ifDescr"
2022-12-23T12:07:04Z D! [inputs.snmp] executing "snmptranslate" "-Td" "-Ob" "IF-MIB::ifIndex"
2022-12-23T12:07:04Z D! [inputs.snmp] executing "snmptranslate" "-Td" "-Ob" "IF-MIB::ifInOctets"
2022-12-23T12:07:05Z D! [inputs.snmp] executing "snmptranslate" "-Td" "-Ob" "IF-MIB::ifOutOctets"
2022-12-23T12:07:05Z D! [inputs.snmp] executing "snmptranslate" "-Td" "-Ob" "DNOS-SWITCHING-MIB::agentPortStatsRateBitsPerSecondRx"
2022-12-23T12:07:05Z D! [inputs.snmp] executing "snmptranslate" "-Td" "-Ob" "DNOS-SWITCHING-MIB::agentPortStatsRateBitsPerSecondTx"
2022-12-23T12:07:06Z E! [inputs.snmp] Error in plugin: agent udp://192.168.1.21:161: gathering table Dell N-Series Interface: performing bulk walk for field ifName: unknown username
2022-12-23T12:07:06Z D! [agent] Stopping service inputs
2022-12-23T12:07:06Z D! [agent] Input channel closed
2022-12-23T12:07:06Z D! [agent] Stopped Successfully
2022-12-23T12:07:06Z E! [telegraf] Error running agent: input plugins recorded 1 errors
```

### System info

Telegraf 1.18.2, Debian 10 (buster)

### Steps to reproduce

1. Install Telegraf 1.18.2 (or later) 
2. telegraf --config /etc/telegraf/telegraf.conf --test --debug

### Expected behavior

Expect a return of the snmp metrics defined in telegraf.conf for the associated agent(s)

### Actual behavior

Error occurs stating unknown username for agent(s)

### Additional info

performing snmpwalk using the same Auth and Priv protocols and secrets works correctly

**Comment by Hipska** [comment]
For info, telegraf changes: https://github.com/influxdata/telegraf/compare/v1.18.1...v1.18.2, gosnmp changes: https://github.com/gosnmp/gosnmp/compare/v1.30.0...v1.31.0

**Comment by Hipska** [comment]
@SuperQ, @TimRots could you have a look as well?

**Comment by SuperQ** [comment]
I don't think there were any changes in those versions that would have caused things to stop working.

**Comment by SuperQ** [comment]
According to the error, the error is actually coming from the device. The configuration is missing the SNMPv3 required username parameter. Perhaps the default in Telegraf changed?

**Comment by Hipska** [comment]
What about https://github.com/gosnmp/gosnmp/blob/f6c004e14098996fd473bcb322fbc8947e33f65a/marshal.go#L303-L306 versus https://github.com/gosnmp/gosnmp/blob/5160c2c028ca49af840a9c1ba56319f8e8fcb11b/marshal.go#L343-L344

This is a relevant change between these 2 versions..

**Comment by SuperQ** [comment]
Those changes are to better handle and report errors back to the user about SNMP packet errors. In this case `ErrUnknownUsername       = errors.New("unknown username")` is being returned because the device that is being walked says the username is invalid.

**Comment by Hipska** [comment]
Yeah indeed, but the version before did `break waitingResponse` and user says telegraf does return data in that case..

**Comment by schwartzpub** [comment]
`tcpdump: verbose output suppressed, use -v or -vv for full protocol decode
listening on ens160, link-type EN10MB (Ethernet), capture size 262144 bytes
09:15:33.453601 IP hostname.46036 > 192.168.1.21.snmp:  F=r U="" E= C="" GetRequest(14)
09:15:33.455262 IP 192.168.1.21.snmp > hostname.46036:  F= U="" E=redact C="" Report(32)  S:snmpUsmMIB.usmMIBObjects.usmStats.usmStatsUnknownUserNames.0=20532
09:15:33.455643 IP hostname.35134 > 192.168.1.21.snmp:  F=r U="" E= C="" GetRequest(14)
09:15:33.458164 IP 192.168.1.21.snmp > hostname.35134:  F= U="" E=redact C="" Report(32)  S:snmpUsmMIB.usmMIBObjects.usmStats.usmStatsUnknownUserNames.0=20533
09:15:38.507047 ARP, Request who-has 192.168.1.21 tell hostname, length 28
09:15:38.507797 ARP, Reply 192.168.1.21 is-at hwid (oui Unknown), length 46`

This is the tcpdump when running telegraf 1.18.2, so it does look like the device itself is returning unknown username.

**Comment by Hipska** [comment]
@schwartzpub but this is no proof of the device sending actual data, correct?

**Comment by schwartzpub** [comment]
I rolled back to gosnmp 1.30.0 in the test above and the bulkwalk worked as expected.

Rolled forward one version to 1.31.0 and receive the unknown username error.

Thanks!

**Comment by Hipska** [comment]
Great, please report that exact stuff to gosnmp directly, they will know better what the issue is and they might be able to fix..

**Comment by Hipska** [comment]
@schwartzpub did you create an issue at [gosnmp](https://github.com/gosnmp/gosnmp)?

**Comment by schwartzpub** [comment]
My apologies, I thought I had closed this issue.  This ended up being a bug in the firmware version for our network devices we were on at the time.

**Comment by Hipska** [comment]
Thanks for coming back anyway!
