### ISSUE TITLE
MQTT_Consumer does not working in Telegraf 1.33.0 (git: HEAD@67902005)

### ISSUE THREAD

**Issue by mmsfla** [influxdata/telegraf#16370]
### Relevant telegraf.conf

```toml
pi@raspberrypi3:~ $ cat /etc/telegraf/telegraf.d/mqtt-input.conf && cat /etc/telegraf/telegraf.d/influx-output.conf 
[[inputs.mqtt_consumer]]
  servers = ["tcp://127.0.0.1:1883"]
  topics = [ 
    "#", 
  ]
  data_format = "influx"
  
[[outputs.influxdb]]
  urls = ["http://127.0.0.1:8086"]
  database = "mppsolar"
  skip_database_creation = true
  username = "xxx removed xxx"
  password = "xxx removed xxx"

pi@raspberrypi3:~ $
```

### Logs from Telegraf

```text
pi@raspberrypi3:~ $ tail -f /var/log/telegraf/telegraf.log
2025-01-05T08:57:21Z I! Loaded secretstores:
2025-01-05T08:57:21Z I! Loaded outputs: influxdb
2025-01-05T08:57:21Z I! Tags enabled: host=raspberrypi3
2025-01-05T08:57:21Z I! [agent] Config: Interval:10s, Quiet:false, Hostname:"raspberrypi3", Flush Interval:10s
2025-01-05T08:57:21Z D! [agent] Initializing plugins
2025-01-05T08:57:21Z D! [agent] Connecting outputs
2025-01-05T08:57:21Z D! [agent] Attempting connection to [outputs.influxdb]
2025-01-05T08:57:21Z D! [agent] Successfully connected to outputs.influxdb
2025-01-05T08:57:21Z D! [agent] Starting service inputs
2025-01-05T08:57:21Z I! [inputs.mqtt_consumer] Connected [tcp://127.0.0.1:1883]
2025-01-05T08:57:31Z D! [outputs.influxdb] Buffer fullness: 0 / 10000 metrics
2025-01-05T08:57:41Z D! [outputs.influxdb] Buffer fullness: 0 / 10000 metrics
--------------
tcp-dump: 
pi@raspberrypi3:~ $ sudo tcpdump -i lo | grep 8086
tcpdump: verbose output suppressed, use -v[v]... for full protocol decode
listening on lo, link-type EN10MB (Ethernet), snapshot length 262144 bytes
09:41:35.808616 IP localhost.44359 > localhost.39098: Flags [P.], seq 406:407, ack 1, win 512, options [nop,nop,TS val 2788121118 ecr 2788121118], length 1
09:43:25.808630 IP localhost.47071 > localhost.1883: Flags [P.], seq 14991:15039, ack 5, win 512, options [nop,nop,TS val 2788231118 ecr 2788231118], length 48
09:45:43.880860 IP localhost.1883 > localhost.48711: Flags [.], ack 24468, win 744, options [nop,nop,TS val 2788369191 ecr 2788369191], length 0
09:48:50.438086 IP localhost.43900 > localhost.33139: Flags [.], ack 565, win 512, options [nop,nop,TS val 2788555748 ecr 2788555748], length 0
^C23948 packets captured
47896 packets received by filter
0 packets dropped by kernel
```

### System info

Telegraf 1.33.0 on RaspianOS Bookworm

### Steps to reproduce

Complete error analysis and solution attempts:
https://github-com.translate.goog/jblance/mpp-solar/discussions/523?_x_tr_sl=auto&_x_tr_tl=de&_x_tr_hl=de

### Expected behavior

none

### Actual behavior

none

### Additional info

none

**Comment by mmsfla** [comment]
Sorry, here the englisch url to my error analysis: https://github.com/jblance/mpp-solar/discussions/523

**Comment by mmsfla** [comment]
Thank you for your answer.
Here the actually mosquitto_sub output ... i think, there is okay

```
pi@raspberrypi3:~ $ mosquitto_sub -h localhost -v -t "#"
EASUN/status/parallel_instance_number/value valid
EASUN/status/serial_number/value 55355535553555
EASUN/status/work_mode/value Battery Mode
EASUN/status/fault_code/value No fault
EASUN/status/grid_voltage/value 233.3
EASUN/status/grid_voltage/unit V
EASUN/status/grid_frequency/value 50.03
EASUN/status/grid_frequency/unit Hz
EASUN/status/ac_output_voltage/value 229.9
EASUN/status/ac_output_voltage/unit V
EASUN/status/ac_output_frequency/value 50.01
EASUN/status/ac_output_frequency/unit Hz
EASUN/status/ac_output_apparent_power/value 91
EASUN/status/ac_output_apparent_power/unit VA
EASUN/status/ac_output_active_power/value 19
EASUN/status/ac_output_active_power/unit W
EASUN/status/load_percentage/value 1
EASUN/status/load_percentage/unit %
EASUN/status/battery_voltage/value 54.5
EASUN/status/battery_voltage/unit V
EASUN/status/battery_charging_current/value 1
EASUN/status/battery_charging_current/unit A
EASUN/status/battery_capacity/value 100
EASUN/status/battery_capacity/unit %
EASUN/status/pv_input_voltage/value 73.6
EASUN/status/pv_input_voltage/unit V
EASUN/status/total_charging_current/value 1
EASUN/status/total_charging_current/unit A
EASUN/status/total_ac_output_apparent_power/value 91
EASUN/status/total_ac_output_apparent_power/unit VA
EASUN/status/total_output_active_power/value 19
EASUN/status/total_output_active_power/unit W
EASUN/status/total_ac_output_percentage/value 0
EASUN/status/total_ac_output_percentage/unit %
EASUN/status/is_scc_ok/value 1
EASUN/status/is_scc_ok/unit bool
EASUN/status/is_ac_charging/value 0
EASUN/status/is_ac_charging/unit bool
EASUN/status/is_scc_charging/value 1
EASUN/status/is_scc_charging/unit bool
EASUN/status/is_battery_over_voltage/value 0
EASUN/status/is_battery_over_voltage/unit bool
EASUN/status/is_battery_under_voltage/value 0
EASUN/status/is_battery_under_voltage/unit bool
EASUN/status/is_line_lost/value 0
EASUN/status/is_line_lost/unit bool
EASUN/status/is_load_on/value 1
EASUN/status/is_load_on/unit bool
EASUN/status/is_configuration_changed/value 0
EASUN/status/is_configuration_changed/unit bool
EASUN/status/output_mode/value single machine
EASUN/status/charger_source_priority/value Solar first
EASUN/status/max_charger_current/value 20
EASUN/status/max_charger_current/unit A
EASUN/status/max_charger_range/value 110
EASUN/status/max_charger_range/unit A
EASUN/status/max_ac_charger_current/value 2
EASUN/status/max_ac_charger_current/unit A
EASUN/status/pv_input_current/value 1
EASUN/status/pv_input_current/unit A
EASUN/status/battery_discharge_current/value 0
EASUN/status/battery_discharge_current/unit A
EASUN/status/parallel_instance_number/value valid
EASUN/status/serial_number/value 55355535553555
EASUN/status/work_mode/value Battery Mode
EASUN/status/fault_code/value No fault
EASUN/status/grid_voltage/value 233.1
EASUN/status/grid_voltage/unit V
EASUN/status/grid_frequency/value 50.05
EASUN/status/grid_frequency/unit Hz
EASUN/status/ac_output_voltage/value 230.2
EASUN/status/ac_output_voltage/unit V
EASUN/status/ac_output_frequency/value 50.04
EASUN/status/ac_output_frequency/unit Hz
EASUN/status/ac_output_apparent_power/value 91
EASUN/status/ac_output_apparent_power/unit VA
EASUN/status/ac_output_active_power/value 24
EASUN/status/ac_output_active_power/unit W
EASUN/status/load_percentage/value 1
EASUN/status/load_percentage/unit %
EASUN/status/battery_voltage/value 55.0
EASUN/status/battery_voltage/unit V
EASUN/status/battery_charging_current/value 1
EASUN/status/battery_charging_current/unit A
EASUN/status/battery_capacity/value 100
EASUN/status/battery_capacity/unit %
EASUN/status/pv_input_voltage/value 74.0
EASUN/status/pv_input_voltage/unit V
EASUN/status/total_charging_current/value 1
EASUN/status/total_charging_current/unit A
EASUN/status/total_ac_output_apparent_power/value 91
EASUN/status/total_ac_output_apparent_power/unit VA
EASUN/status/total_output_active_power/value 24
EASUN/status/total_output_active_power/unit W
EASUN/status/total_ac_output_percentage/value 0
EASUN/status/total_ac_output_percentage/unit %
EASUN/status/is_scc_ok/value 1
EASUN/status/is_scc_ok/unit bool
EASUN/status/is_ac_charging/value 0
EASUN/status/is_ac_charging/unit bool
EASUN/status/is_scc_charging/value 1
EASUN/status/is_scc_charging/unit bool
EASUN/status/is_battery_over_voltage/value 0
EASUN/status/is_battery_over_voltage/unit bool
EASUN/status/is_battery_under_voltage/value 0
EASUN/status/is_battery_under_voltage/unit bool
EASUN/status/is_line_lost/value 0
EASUN/status/is_line_lost/unit bool
EASUN/status/is_load_on/value 1
EASUN/status/is_load_on/unit bool
EASUN/status/is_configuration_changed/value 0
EASUN/status/is_configuration_changed/unit bool
EASUN/status/output_mode/value single machine
EASUN/status/charger_source_priority/value Solar first
EASUN/status/max_charger_current/value 20
EASUN/status/max_charger_current/unit A
EASUN/status/max_charger_range/value 110
EASUN/status/max_charger_range/unit A
EASUN/status/max_ac_charger_current/value 2
EASUN/status/max_ac_charger_current/unit A
EASUN/status/pv_input_current/value 1
EASUN/status/pv_input_current/unit A
EASUN/status/battery_discharge_current/value 0
EASUN/status/battery_discharge_current/unit A
EASUN/status/parallel_instance_number/value valid
EASUN/status/serial_number/value 55355535553555
EASUN/status/work_mode/value Battery Mode
EASUN/status/fault_code/value No fault
EASUN/status/grid_voltage/value 232.9
EASUN/status/grid_voltage/unit V
EASUN/status/grid_frequency/value 50.04
EASUN/status/grid_frequency/unit Hz
EASUN/status/ac_output_voltage/value 230.0
EASUN/status/ac_output_voltage/unit V
EASUN/status/ac_output_frequency/value 50.04
EASUN/status/ac_output_frequency/unit Hz
EASUN/status/ac_output_apparent_power/value 92
EASUN/status/ac_output_apparent_power/unit VA
EASUN/status/ac_output_active_power/value 20
EASUN/status/ac_output_active_power/unit W
EASUN/status/load_percentage/value 1
EASUN/status/load_percentage/unit %
EASUN/status/battery_voltage/value 54.5
EASUN/status/battery_voltage/unit V
EASUN/status/battery_charging_current/value 0
EASUN/status/battery_charging_current/unit A
EASUN/status/battery_capacity/value 100
EASUN/status/battery_capacity/unit %
EASUN/status/pv_input_voltage/value 73.7
EASUN/status/pv_input_voltage/unit V
EASUN/status/total_charging_current/value 0
EASUN/status/total_charging_current/unit A
EASUN/status/total_ac_output_apparent_power/value 92
EASUN/status/total_ac_output_apparent_power/unit VA
EASUN/status/total_output_active_power/value 20
EASUN/status/total_output_active_power/unit W
EASUN/status/total_ac_output_percentage/value 0
EASUN/status/total_ac_output_percentage/unit %
EASUN/status/is_scc_ok/value 1
EASUN/status/is_scc_ok/unit bool
EASUN/status/is_ac_charging/value 0
EASUN/status/is_ac_charging/unit bool
EASUN/status/is_scc_charging/value 1
EASUN/status/is_scc_charging/unit bool
EASUN/status/is_battery_over_voltage/value 0
EASUN/status/is_battery_over_voltage/unit bool
EASUN/status/is_battery_under_voltage/value 0
EASUN/status/is_battery_under_voltage/unit bool
EASUN/status/is_line_lost/value 0
EASUN/status/is_line_lost/unit bool
EASUN/status/is_load_on/value 1
EASUN/status/is_load_on/unit bool
EASUN/status/is_configuration_changed/value 0
EASUN/status/is_configuration_changed/unit bool
EASUN/status/output_mode/value single machine
EASUN/status/charger_source_priority/value Solar first
EASUN/status/max_charger_current/value 20
EASUN/status/max_charger_current/unit A
EASUN/status/max_charger_range/value 110
EASUN/status/max_charger_range/unit A
EASUN/status/max_ac_charger_current/value 2
EASUN/status/max_ac_charger_current/unit A
EASUN/status/pv_input_current/value 1
EASUN/status/pv_input_current/unit A
EASUN/status/battery_discharge_current/value 0
EASUN/status/battery_discharge_current/unit A
^Cpi@raspberrypi3:~ $ date
Sun 16 Feb 10:52:47 CET 2025

```

**Comment by mmsfla** [comment]
Here my database. 
There is no input. 
I dont know why.
```

pi@raspberrypi3:~ $ influx
Connected to http://localhost:8086 version 1.6.7~rc0
InfluxDB shell version: 1.6.7~rc0
> use mppsolar
Using database mppsolar
> show MEASUREMENTS
```
>

**Comment by mmsfla** [comment]
Sorry, 
I overlooked that an update for Telegraf is available.
Version 1.33_2.1
Please give me a few days.
I'm short on time right now.

**Comment by srebhan** [comment]
@mmsfla you set `data_format = "influx"` but your _actual_ data-format is just a single value! You should try

```toml
[[inputs.mqtt_consumer]]
  servers = ["tcp://127.0.0.1:1883"]
  topics = [ 
    "#", 
  ]
  data_format = "value"
  data_type = "auto_float"
  
[[outputs.influxdb]]
  urls = ["http://127.0.0.1:8086"]
  database = "mppsolar"
  skip_database_creation = true
  username = "xxx removed xxx"
  password = "xxx removed xxx"
```

instead!
