### ISSUE TITLE
Allow an input's name_override to be blank / null

### ISSUE THREAD

**Issue by musicsnob** [influxdata/telegraf#5849]
## Feature Request

I hope that I am not misunderstanding the current name_override functionality! I suspect name_override currently works correctly and as designed, but is not granular enough. Thanks for reading.

### Proposal:
For input plugins, allow name_override to be blank/null. Or, allow name_override to work at the field level in addition to the input level.

### Current behavior:
Per https://github.com/influxdata/telegraf/blob/master/docs/CONFIGURATION.md,
> name_override: Override the base name of the measurement. (Default is the name of the input).

Within the telegraf config, setting an input's name_override = "" causes the measurement's base name to remain the name of the input. Setting name_override = null causes an config file error. 

### Desired behavior:
Use only the field's name without prepending the name of the input, if desired by the user, or allow name_override to function at the input field level. 

### Use case: 
With the SNMP plugin, the user may wish to name metrics like so:
```
    [[inputs.snmp.field]]
        name = "system.host"
        oid = "SNMPv2-MIB::sysName.0"
        is_tag = true
    [[inputs.snmp.field]]
        name = "system.uptime"
        oid = "HOST-RESOURCES-MIB::hrSystemUptime.0"
    [[inputs.snmp.field]]
        name = "system.n_users"
        oid = "HOST-RESOURCES-MIB::hrSystemNumUsers.0"
    [[inputs.snmp.field]]
        name = "mem.total"
        oid = "UCD-SNMP-MIB::memTotalReal.0"
    [[inputs.snmp.field]]
        name = "mem.available"
        oid = "UCD-SNMP-MIB::memAvailReal.0"
```

However, the plugin behavior results in measurements named "snmp.system.uptime", "snmp.mem.total", etc. There does not appear to be a way to instead output only "system.uptime", "mem.total", etc. This can cause downstream data integration issues when combining metrics from different inputs, such as inputs.system, inputs.mem, and inputs.snmp.

**Comment by danielnelson** [comment]
Telegraf's [metric] model requires both a "measurement name" and one more more field names.  The measurement name should be something that describes the category of items, here you would want `system` or `mem`.  The field name would describe the individual values `host`, `uptime`, `total`, `available`.

Exactly how this ends up being output depends on the output plugin, with InfluxDB the translation is direct, but it looks like maybe you are using the graphite or wavefront outputs.

Either way, I think what might work well for you is to have multiple plugins defined, one for each measurement.
```toml
[[inputs.snmp]]
    name_override = "system"
    [[inputs.snmp.field]]
        name = "host"
        oid = "SNMPv2-MIB::sysName.0"
        is_tag = true
    [[inputs.snmp.field]]
        name = "uptime"
        oid = "HOST-RESOURCES-MIB::hrSystemUptime.0"
    [[inputs.snmp.field]]
        name = "n_users"
        oid = "HOST-RESOURCES-MIB::hrSystemNumUsers.0"

[[inputs.snmp]]
    name_override = "mem"
    [[inputs.snmp.field]]
        name = "total"
        oid = "UCD-SNMP-MIB::memTotalReal.0"
    [[inputs.snmp.field]]
        name = "available"
        oid = "UCD-SNMP-MIB::memAvailReal.0"
```

[metric]: https://github.com/influxdata/telegraf/blob/master/docs/METRICS.md

**Comment by musicsnob** [comment]
Hi Daniel, thanks, I appreciate the quick response. I'd considered having one plugin per SNMP / MIB measurement, but didn't pursue it for concern it was maybe too hacky... I am using outputs.http to send to Splunk's HEC using `data_format = "splunkmetric"`.

**Comment by danielnelson** [comment]
It occurs to me that something like this should work as well:
```toml
[[inputs.snmp]]
    agents = ["127.0.0.1"]
    community = "public"
    version = 2

    [[inputs.snmp.field]]
        name = "host"
        oid = "SNMPv2-MIB::sysName.0"
        is_tag = true

    [[inputs.snmp.table]]
        name = "system"
        inherit_tags = ["host"]
        [[inputs.snmp.table.field]]
            name = "uptime"
            oid = "HOST-RESOURCES-MIB::hrSystemUptime"
        [[inputs.snmp.table.field]]
            name = "n_users"
            oid = "HOST-RESOURCES-MIB::hrSystemNumUsers"

    [[inputs.snmp.table]]
        name = "mem"
        inherit_tags = ["host"]
        [[inputs.snmp.table.field]]
            name = "total"
            oid = "UCD-SNMP-MIB::memTotalReal"
        [[inputs.snmp.table.field]]
            name = "available"
            oid = "UCD-SNMP-MIB::memAvailReal"
```

**Comment by musicsnob** [comment]
Hi Daniel, your table idea worked very well, thank you. I didn't realize that a table could be used in that fashion. I assumed it was only used for iterating across a group of child items (say, hrDevice as a table, and hrDeviceType as a table.field), as opposed to a single entry such as sysName. Perhaps that's where the indexed ".1", ".2", etc come into play? 

Anyways, thanks again for the really helpful tips!

**Comment by danielnelson** [comment]
I think this might actually be a misuse of the table feature, not entirely sure if it was intended, the table option was really designed for handling conceptual tables.

This method does do a walk over the OIDs which is not the most efficient way to grab this data, here are the calls we currently make only for the system table in tcpdump:
```
16:06:23.672947 IP localhost.36534 > localhost.snmp:  GetBulk(28)  N=0 M=10 25.1.1
16:06:23.679251 IP localhost.snmp > localhost.36534:  GetResponse(328)  25.1.1.0=13212527 25.1.2.0=07_e3_05_0e_10_06_17_00_2d_07_00 25.1.3.0=393216 25.1.4.0="BOOT_IMAGE=/boot/vmlinuz-4.19.27-gentoo-r1 root=/dev/mapper/xyzzy-gentoo ro crypt_root=UUID=0391d1ca-c156-427b-b329-b6500cb4b0b1" 25.1.5.0=5 25.1.6.0=166 25.1.7.0=0 25.2.2.0=20423692 25.2.3.1.1.1=1 25.2.3.1.1.3=3
16:06:23.679426 IP localhost.36534 > localhost.snmp:  GetBulk(28)  N=0 M=10 25.1.5
16:06:23.679666 IP localhost.snmp > localhost.36534:  GetResponse(191)  25.1.5.0=5 25.1.6.0=166 25.1.7.0=0 25.2.2.0=20423692 25.2.3.1.1.1=1 25.2.3.1.1.3=3 25.2.3.1.1.6=6 25.2.3.1.1.7=7 25.2.3.1.1.8=8 25.2.3.1.1.10=10
```
