### ISSUE TITLE
ifName processor is walking entire table

### ISSUE THREAD

**Issue by Hipska** [influxdata/telegraf#8801]
### Relevant telegraf.conf:

```toml
[[processors.ifname]]
  ## Name of tag holding the interface number
  # tag = "ifIndex"

  ## Name of output tag where service name will be added
  # dest = "ifName"

  ## Name of tag of the SNMP agent to request the interface name from
  agent = "agent_host"

  ## Timeout for each request.
  timeout = "5s"

  ## SNMP version; can be 1, 2, or 3.
  version = 2

  ## SNMP community string.
  community = "public"

  ## Number of retries to attempt.
  retries = 3

  ## The GETBULK max-repetitions parameter.
  max_repetitions = 100
```

### System info:

Telegraf 1.17.2 (git: HEAD 74011e22)

### Steps to reproduce:

1. run `tcpdump` to gather the snmp requests
2. run `telegraf --test` with a simple config

### Expected behavior:

Telegraf should only send out a walk for ifName:

> 13:36:21.422863 IP localhost.48131 > remote.snmp:  C="public" GetRequest(28)  system.sysName.0
13:36:21.425999 IP localhost.48131 > remote.snmp:  C="public" GetRequest(28)  system.sysUpTime.0
13:36:21.429034 IP localhost.48131 > remote.snmp:  C="public" GetBulk(34)  N=0 M=100 E:2636.3.60.1.2.1.1.1
13:36:21.485792 IP localhost.48131 > remote.snmp:  C="public" GetBulk(34)  N=0 M=100 E:2636.3.60.1.2.1.1.6
13:36:21.514070 IP localhost.50275 > remote.snmp:  C="public" GetBulk(30)  N=0 M=100 31.1.1.1.1
13:36:21.540230 IP localhost.50275 > remote.snmp:  C="public" GetBulk(32)  N=0 M=100 31.1.1.1.1.583
13:36:21.569860 IP localhost.50275 > remote.snmp:  C="public" GetBulk(32)  N=0 M=100 31.1.1.1.1.683
13:36:21.594224 IP localhost.50275 > remote.snmp:  C="public" GetBulk(32)  N=0 M=100 31.1.1.1.1.783
13:36:21.619846 IP localhost.50275 > remote.snmp:  C="public" GetBulk(32)  N=0 M=100 31.1.1.1.1.886

### Actual behavior:

Telegraf sends out a walk for all fields in ifXTable:

> 13:36:21.422863 IP localhost.48131 > remote.snmp:  C="public" GetRequest(28)  system.sysName.0
13:36:21.425999 IP localhost.48131 > remote.snmp:  C="public" GetRequest(28)  system.sysUpTime.0
13:36:21.429034 IP localhost.48131 > remote.snmp:  C="public" GetBulk(34)  N=0 M=100 E:2636.3.60.1.2.1.1.1
13:36:21.485792 IP localhost.48131 > remote.snmp:  C="public" GetBulk(34)  N=0 M=100 E:2636.3.60.1.2.1.1.6
13:36:21.514070 IP localhost.50275 > remote.snmp:  C="public" GetBulk(30)  N=0 M=100 31.1.1.1.1
13:36:21.540230 IP localhost.50275 > remote.snmp:  C="public" GetBulk(32)  N=0 M=100 31.1.1.1.1.583
13:36:21.569860 IP localhost.50275 > remote.snmp:  C="public" GetBulk(32)  N=0 M=100 31.1.1.1.1.683
13:36:21.594224 IP localhost.50275 > remote.snmp:  C="public" GetBulk(32)  N=0 M=100 31.1.1.1.1.783
13:36:21.619846 IP localhost.50275 > remote.snmp:  C="public" GetBulk(32)  N=0 M=100 31.1.1.1.1.886
13:36:21.721051 IP localhost.50275 > remote.snmp:  C="public" GetBulk(30)  N=0 M=100 31.1.1.1.2
13:36:21.783942 IP localhost.50275 > remote.snmp:  C="public" GetBulk(32)  N=0 M=100 31.1.1.1.2.583
13:36:22.071901 IP localhost.50275 > remote.snmp:  C="public" GetBulk(32)  N=0 M=100 31.1.1.1.2.683
13:36:22.204948 IP localhost.50275 > remote.snmp:  C="public" GetBulk(32)  N=0 M=100 31.1.1.1.2.783
13:36:22.334704 IP localhost.50275 > remote.snmp:  C="public" GetBulk(32)  N=0 M=100 31.1.1.1.2.886
13:36:22.385728 IP localhost.50275 > remote.snmp:  C="public" GetBulk(30)  N=0 M=100 31.1.1.1.3
13:36:22.409969 IP localhost.50275 > remote.snmp:  C="public" GetBulk(32)  N=0 M=100 31.1.1.1.3.583
13:36:22.433789 IP localhost.50275 > remote.snmp:  C="public" GetBulk(32)  N=0 M=100 31.1.1.1.3.683
13:36:22.457748 IP localhost.50275 > remote.snmp:  C="public" GetBulk(32)  N=0 M=100 31.1.1.1.3.783
13:36:22.481492 IP localhost.50275 > remote.snmp:  C="public" GetBulk(32)  N=0 M=100 31.1.1.1.3.886
13:36:22.506556 IP localhost.50275 > remote.snmp:  C="public" GetBulk(30)  N=0 M=100 31.1.1.1.4
13:36:22.530696 IP localhost.50275 > remote.snmp:  C="public" GetBulk(32)  N=0 M=100 31.1.1.1.4.583
13:36:22.555136 IP localhost.50275 > remote.snmp:  C="public" GetBulk(32)  N=0 M=100 31.1.1.1.4.683
13:36:22.578765 IP localhost.50275 > remote.snmp:  C="public" GetBulk(32)  N=0 M=100 31.1.1.1.4.783
13:36:22.602455 IP localhost.50275 > remote.snmp:  C="public" GetBulk(32)  N=0 M=100 31.1.1.1.4.886
13:36:22.627067 IP localhost.50275 > remote.snmp:  C="public" GetBulk(30)  N=0 M=100 31.1.1.1.5
13:36:22.650952 IP localhost.50275 > remote.snmp:  C="public" GetBulk(32)  N=0 M=100 31.1.1.1.5.583
13:36:22.675069 IP localhost.50275 > remote.snmp:  C="public" GetBulk(32)  N=0 M=100 31.1.1.1.5.683
13:36:22.699110 IP localhost.50275 > remote.snmp:  C="public" GetBulk(32)  N=0 M=100 31.1.1.1.5.783
13:36:22.723356 IP localhost.50275 > remote.snmp:  C="public" GetBulk(32)  N=0 M=100 31.1.1.1.5.886
13:36:22.748437 IP localhost.50275 > remote.snmp:  C="public" GetBulk(30)  N=0 M=100 31.1.1.1.6
13:36:22.772837 IP localhost.50275 > remote.snmp:  C="public" GetBulk(32)  N=0 M=100 31.1.1.1.6.583
13:36:22.797134 IP localhost.50275 > remote.snmp:  C="public" GetBulk(32)  N=0 M=100 31.1.1.1.6.683
13:36:22.821304 IP localhost.50275 > remote.snmp:  C="public" GetBulk(32)  N=0 M=100 31.1.1.1.6.783
13:36:22.844959 IP localhost.50275 > remote.snmp:  C="public" GetBulk(32)  N=0 M=100 31.1.1.1.6.886
13:36:22.869450 IP localhost.50275 > remote.snmp:  C="public" GetBulk(30)  N=0 M=100 31.1.1.1.7
13:36:22.893113 IP localhost.50275 > remote.snmp:  C="public" GetBulk(32)  N=0 M=100 31.1.1.1.7.583
13:36:22.917964 IP localhost.50275 > remote.snmp:  C="public" GetBulk(32)  N=0 M=100 31.1.1.1.7.683
13:36:22.945155 IP localhost.50275 > remote.snmp:  C="public" GetBulk(32)  N=0 M=100 31.1.1.1.7.783
13:36:22.970604 IP localhost.50275 > remote.snmp:  C="public" GetBulk(32)  N=0 M=100 31.1.1.1.7.886
13:36:23.000666 IP localhost.50275 > remote.snmp:  C="public" GetBulk(30)  N=0 M=100 31.1.1.1.8
13:36:23.026744 IP localhost.50275 > remote.snmp:  C="public" GetBulk(32)  N=0 M=100 31.1.1.1.8.583
13:36:23.051093 IP localhost.50275 > remote.snmp:  C="public" GetBulk(32)  N=0 M=100 31.1.1.1.8.683
13:36:23.075206 IP localhost.50275 > remote.snmp:  C="public" GetBulk(32)  N=0 M=100 31.1.1.1.8.783
13:36:23.100019 IP localhost.50275 > remote.snmp:  C="public" GetBulk(32)  N=0 M=100 31.1.1.1.8.886
13:36:23.124686 IP localhost.50275 > remote.snmp:  C="public" GetBulk(30)  N=0 M=100 31.1.1.1.9
13:36:23.151775 IP localhost.50275 > remote.snmp:  C="public" GetBulk(32)  N=0 M=100 31.1.1.1.9.583
13:36:23.176165 IP localhost.50275 > remote.snmp:  C="public" GetBulk(32)  N=0 M=100 31.1.1.1.9.683
13:36:23.213872 IP localhost.50275 > remote.snmp:  C="public" GetBulk(32)  N=0 M=100 31.1.1.1.9.783
13:36:23.238273 IP localhost.50275 > remote.snmp:  C="public" GetBulk(32)  N=0 M=100 31.1.1.1.9.886
13:36:23.263747 IP localhost.50275 > remote.snmp:  C="public" GetBulk(30)  N=0 M=100 31.1.1.1.10
13:36:23.287883 IP localhost.50275 > remote.snmp:  C="public" GetBulk(32)  N=0 M=100 31.1.1.1.10.583
13:36:23.311962 IP localhost.50275 > remote.snmp:  C="public" GetBulk(32)  N=0 M=100 31.1.1.1.10.683
13:36:23.335584 IP localhost.50275 > remote.snmp:  C="public" GetBulk(32)  N=0 M=100 31.1.1.1.10.783
13:36:23.360054 IP localhost.50275 > remote.snmp:  C="public" GetBulk(32)  N=0 M=100 31.1.1.1.10.886
13:36:23.384975 IP localhost.50275 > remote.snmp:  C="public" GetBulk(30)  N=0 M=100 31.1.1.1.11
13:36:23.408802 IP localhost.50275 > remote.snmp:  C="public" GetBulk(32)  N=0 M=100 31.1.1.1.11.583
13:36:23.432938 IP localhost.50275 > remote.snmp:  C="public" GetBulk(32)  N=0 M=100 31.1.1.1.11.683
13:36:23.457239 IP localhost.50275 > remote.snmp:  C="public" GetBulk(32)  N=0 M=100 31.1.1.1.11.783
13:36:23.481194 IP localhost.50275 > remote.snmp:  C="public" GetBulk(32)  N=0 M=100 31.1.1.1.11.886
13:36:23.506148 IP localhost.50275 > remote.snmp:  C="public" GetBulk(30)  N=0 M=100 31.1.1.1.12
13:36:23.530041 IP localhost.50275 > remote.snmp:  C="public" GetBulk(32)  N=0 M=100 31.1.1.1.12.583
13:36:23.553984 IP localhost.50275 > remote.snmp:  C="public" GetBulk(32)  N=0 M=100 31.1.1.1.12.683
13:36:23.578076 IP localhost.50275 > remote.snmp:  C="public" GetBulk(32)  N=0 M=100 31.1.1.1.12.783
13:36:23.602655 IP localhost.50275 > remote.snmp:  C="public" GetBulk(32)  N=0 M=100 31.1.1.1.12.886
13:36:23.627874 IP localhost.50275 > remote.snmp:  C="public" GetBulk(30)  N=0 M=100 31.1.1.1.13
13:36:23.652573 IP localhost.50275 > remote.snmp:  C="public" GetBulk(32)  N=0 M=100 31.1.1.1.13.583
13:36:23.676723 IP localhost.50275 > remote.snmp:  C="public" GetBulk(32)  N=0 M=100 31.1.1.1.13.683
13:36:23.700905 IP localhost.50275 > remote.snmp:  C="public" GetBulk(32)  N=0 M=100 31.1.1.1.13.783
13:36:23.725045 IP localhost.50275 > remote.snmp:  C="public" GetBulk(32)  N=0 M=100 31.1.1.1.13.886
13:36:23.750096 IP localhost.50275 > remote.snmp:  C="public" GetBulk(30)  N=0 M=100 31.1.1.1.14
13:36:23.775973 IP localhost.50275 > remote.snmp:  C="public" GetBulk(32)  N=0 M=100 31.1.1.1.14.583
13:36:23.803056 IP localhost.50275 > remote.snmp:  C="public" GetBulk(32)  N=0 M=100 31.1.1.1.14.683
13:36:23.828201 IP localhost.50275 > remote.snmp:  C="public" GetBulk(32)  N=0 M=100 31.1.1.1.14.783
13:36:23.852172 IP localhost.50275 > remote.snmp:  C="public" GetBulk(32)  N=0 M=100 31.1.1.1.14.886
13:36:23.878085 IP localhost.50275 > remote.snmp:  C="public" GetBulk(30)  N=0 M=100 31.1.1.1.15
13:36:23.902817 IP localhost.50275 > remote.snmp:  C="public" GetBulk(32)  N=0 M=100 31.1.1.1.15.583
13:36:23.927145 IP localhost.50275 > remote.snmp:  C="public" GetBulk(32)  N=0 M=100 31.1.1.1.15.683
13:36:23.951416 IP localhost.50275 > remote.snmp:  C="public" GetBulk(32)  N=0 M=100 31.1.1.1.15.783
13:36:23.976299 IP localhost.50275 > remote.snmp:  C="public" GetBulk(32)  N=0 M=100 31.1.1.1.15.886
13:36:24.001344 IP localhost.50275 > remote.snmp:  C="public" GetBulk(30)  N=0 M=100 31.1.1.1.16
13:36:24.025601 IP localhost.50275 > remote.snmp:  C="public" GetBulk(32)  N=0 M=100 31.1.1.1.16.583
13:36:24.049786 IP localhost.50275 > remote.snmp:  C="public" GetBulk(32)  N=0 M=100 31.1.1.1.16.683
13:36:24.073785 IP localhost.50275 > remote.snmp:  C="public" GetBulk(32)  N=0 M=100 31.1.1.1.16.783
13:36:24.097797 IP localhost.50275 > remote.snmp:  C="public" GetBulk(32)  N=0 M=100 31.1.1.1.16.886
13:36:24.124456 IP localhost.50275 > remote.snmp:  C="public" GetBulk(30)  N=0 M=100 31.1.1.1.17
13:36:24.149000 IP localhost.50275 > remote.snmp:  C="public" GetBulk(32)  N=0 M=100 31.1.1.1.17.583
13:36:24.173006 IP localhost.50275 > remote.snmp:  C="public" GetBulk(32)  N=0 M=100 31.1.1.1.17.683
13:36:24.197543 IP localhost.50275 > remote.snmp:  C="public" GetBulk(32)  N=0 M=100 31.1.1.1.17.783
13:36:24.221519 IP localhost.50275 > remote.snmp:  C="public" GetBulk(32)  N=0 M=100 31.1.1.1.17.886
13:36:24.246806 IP localhost.50275 > remote.snmp:  C="public" GetBulk(30)  N=0 M=100 31.1.1.1.18
13:36:24.271489 IP localhost.50275 > remote.snmp:  C="public" GetBulk(32)  N=0 M=100 31.1.1.1.18.583
13:36:24.297906 IP localhost.50275 > remote.snmp:  C="public" GetBulk(32)  N=0 M=100 31.1.1.1.18.683
13:36:24.323963 IP localhost.50275 > remote.snmp:  C="public" GetBulk(32)  N=0 M=100 31.1.1.1.18.783
13:36:24.351174 IP localhost.50275 > remote.snmp:  C="public" GetBulk(32)  N=0 M=100 31.1.1.1.18.886
13:36:24.376844 IP localhost.50275 > remote.snmp:  C="public" GetBulk(30)  N=0 M=100 31.1.1.1.19
13:36:24.401555 IP localhost.50275 > remote.snmp:  C="public" GetBulk(32)  N=0 M=100 31.1.1.1.19.583
13:36:24.426292 IP localhost.50275 > remote.snmp:  C="public" GetBulk(32)  N=0 M=100 31.1.1.1.19.683
13:36:24.450954 IP localhost.50275 > remote.snmp:  C="public" GetBulk(32)  N=0 M=100 31.1.1.1.19.783
13:36:24.475259 IP localhost.50275 > remote.snmp:  C="public" GetBulk(32)  N=0 M=100 31.1.1.1.19.886

### Additional info:

This section gets the list of all fields, I think we can remove the fields that are not needed in there?
https://github.com/influxdata/telegraf/blob/3b8df55b9c8c15353b8778ab3a19f0b1a5021d29/plugins/processors/ifname/ifname.go#L350-L364
